<!ELEMENT catalogo (producto)+>
<!ELEMENT producto (nombre, descripcion?, (origen | pais))>
    <!ATTLIST producto codigo ID #IMPLIED>
<!ELEMENT nombre (#PCDATA)>
<!ELEMENT descripcion (#PCDATA)>
<!ELEMENT pais (#PCDATA)>
<!ELEMENT origen (#PCDATA)>